Recommended;Profitable;Investment;Savings;SeebClassificationDescription;ProposalID;ProposalHeadline;SeebClassification
False;False;2400;40;Loft;8;Udskiftning af eksisterende loftslem til ny præfabrikeret loftslem;1-1-1-0
False;False;10200;90;Hule vægge mod uopvarmet rum;4;Udvendig efterisolering af vægge mod uopvarmet rum med 150 mm;1-2-1-1
False;False;15300;90;Lette ydervægge;6;Efterisolering af tagrem af træ med 250 mm isolering og fjernelse af eksisterende isolering;1-2-3-0
False;False;15700;200;Loft;7;Efterisolering af loftsrum med 200 mm isolering;1-1-1-0
False;False;25000;80;Terrændæk;5;Ophugning af eksisterende terrændæk og støbning af nyt med 450 mm mineraluld eller polystyrenplader;1-4-1-0
False;False;46600;500;Hule ydervægge;3;Indvendig montage af forsatsvæg med 150 mm isolering;1-2-1-0
False;False;50800;600;Loft;1;Efterisolering af loftsrum med 250 mm isolering;1-1-1-0
False;False;88600;900;Hule ydervægge;0;Indvendig montage af forsatsvæg med 150 mm isolering;1-2-1-0
False;False;380000;800;Terrændæk;2;Ophugning af eksisterende terrændæk og støbning af nyt med 450 mm mineraluld eller polystyrenplader;1-4-1-0
