Recommended;Profitable;Investment;Savings;SeebClassificationDescription;ProposalID;ProposalHeadline;SeebClassification
False;False;6800;300;Vinduer;5;Udskiftning af ruder i vindue mod udestue.;1-3-1-0
False;False;10800;200;Vinduer;6;Udskiftning af vindue i spisestue.;1-3-1-0
False;False;18900;600;Yderdøre;4;Udskiftning af ruder i skydedørsparti.;1-3-3-0
False;True;26000;1500;Loft;1;Efterisolering af loftsrum med 200 mm isolering.;1-1-1-0
False;True;27000;2800;Kedler;2;Udskiftning af gaskedel.;2-1-2-0
False;False;29300;800;Yderdøre;3;Udskiftning af yderdøre i hall og bryggers.;1-3-3-0
False;True;52500;3400;Solceller;0;Montage af 2,8 kW solcelleanlæg.;4-1-3-0
False;False;346900;3200;Terrændæk;7;Ophugning af eksisterende terrændæk og støbning af nyt med 400 mm mineraluld eller polystyrenplader.;1-4-1-0
