Investment;Recommended;SeebClassificationDescription;ProposalID;Profitable;Savings;ProposalHeadline;SeebClassification
9000;False;Yderdøre;4;True;700;Udskiftning af terrassedør mod vest til ny med trelags energiruder;1-3-3-0
9600;False;Yderdøre;1;True;600;Udskiftning af yderdør i gavl mod syd til ny med trelags energiruder;1-3-3-0
9600;False;Yderdøre;3;True;700;Udskiftning af yderdør mod øst til ny med trelags energirude;1-3-3-0
18000;False;Varmepumper;8;True;5900;Installation af nyt luftvarmeanlæg, (luft/luft), 4,7 kW som type IVT Nordic 12 LR-N;2-1-5-0
23500;False;Vinduer;2;True;1700;Udskiftning af vinduer i facade mod øst til nye med trelags energiruder;1-3-1-0
28000;False;Loft;0;True;1500;Efterisolering af loftsrum med 150 mm isolering.;1-1-1-0
30100;False;Vinduer;5;True;2100;Udskiftning af vinduer i facade mod vest til nye med trelags energiruder;1-3-1-0
50000;False;Solvarme;7;True;2600;Montering af plan solfanger og beholder til varme og brugsvand;2-1-6-0
111200;False;Solceller;6;True;9000;Montage af nye solceller, Monokrystaliske silicium, 6 kW;4-1-3-0
