Investment;Recommended;SeebClassificationDescription;ProposalID;Profitable;Savings;ProposalHeadline;SeebClassification
36800;False;Varmtvandsrør;0;True;1400;Isolering af varmefordelingsrør op til 50 mm og Isolering af brugsvandsrør og cirkulationsledning op til 50 mm;3-1-3-0
85800;False;Yderdøre;2;False;2800;Montage af nye, isoleret yderdøre ;1-3-3-0
120200;False;Solceller;1;True;10800;Montage af nye solceller, Monokrystallinske silicium, 7,2 kW;4-1-3-0
156000;False;Vinduer;5;True;7100;Udskiftning af vinduer med 1 lags glas til nye med trelags energirude, energiklasse A.;1-3-1-0
407400;False;Belysning;4;True;42900;Installation af LED panel, med dagslysstyring og bevægelsesmelder, iht. 2016 krav;4-1-1-0
974200;False;Vinduer;3;False;12600;Udskiftning af vinduer til trelags energirude, energiklasse A.;1-3-1-0
